{
  "schema_version": 1,
  "id": "hyp-mobile-handler",
  "workspace_id": "workspace-fixture",
  "case_id": "case-fixture",
  "revision_id": "revision-1",
  "title": "Mobile button handler missing",
  "statement": "The incident build does not attach a handler to the narrow-viewport pay button.",
  "mechanism_description": "Click has no order-creation effect.",
  "status": "accepted",
  "supporting_evidence_ids": [
    "evidence-1"
  ],
  "contradicting_evidence_ids": [],
  "missing_evidence": [
    "External deployment exposure is not established."
  ],
  "falsifier": "Known-good and incident both complete mobile checkout under the same fixture.",
  "proposed_test_kinds": [
    "mechanism"
  ],
  "origin": "human",
  "priority": "normal"
}
